year,age,country,city,korean_level,stress,happiness,nostalgia_kz,belonging_kr,friends_count,sleep_quality,notes
2019,14,Kazakhstan,Taraz,0,4,10,1,0,15,10,"Started attending a dance studio for K-pop and other styles, and began learning actively. I made many friends with similar interests. I was just a schoolgirl who loved to dance"
2020,15,Kazakhstan,Taraz,1,5,9,1,0,12,4,"Started a part-time job while balancing school, dance, and work."
2021,16,Kazakhstan,Taraz,1,9,5,1,0,7,5,"Still working, but now in my final school year ? stressed by exams and decisions about college and my future."
2022,17,South Korea,Uijeongbu,2,10,9,10,1,5,2,"Decided to study in Korea and began preparing documents while studying for Kazakhstan¡¯s Unified National Test (ENT) and national graduation exams. Worked to save money for the move, had fewer friends around, and felt a lot of stress. Moved to Korea at the end of the year."
2023,18,South Korea,Uijeongbu,4,9,10,6,4,3,10,"A year of adaptation. Arriving in Korea felt both lonely and inspiring. I threw myself into language studies, spending up to 10 hours a day at the academy. Everything around me was new, and I explored as much as I could with the money I had."
2024,19,South Korea,Seoul,5,10,5,8,5,2,5,Completed all six levels of the language program and earned TOPIK level 5. Faced new stress from working in Korea and preparing university applications. Was accepted into SeoulTech to study Computer Engineering.
2025,20,South Korea,Seoul,5,8,2,7,7,7,3,"Second year of my bachelor¡¯s. The courses are still challenging, but I¡¯m doing better than in 2024. I changed jobs and started earning more, but my sleep has become worse."
